id;id_no;rev_bis;name_en;name_fr;short_description_en;short_description_fr;justification_en;justification_fr;date_inscribed;secondary_dates;danger_list;longitude;latitude;area_hectares;C1;C2;C3;C4;C5;C6;N7;N8;N9;N10;criteria_txt;category;category_short;states_name_en;states_name_fr;continent_name_en;continent_name_fr;iso_code;udnp_code;transboundary;coordonnees
799;675;;"Joya de Cerén Archaeological Site";"Site archéologique de Joya de Cerén";"<p>Joya de Cer&eacute;n was a pre-Hispanic farming community that, like Pompeii and Herculaneum in Italy, was buried under an eruption of the Laguna Caldera volcano c. AD 600. Because of the exceptional condition of the remains, they provide an insight in";"<p>Joya de Ceren &eacute;tait une communaut&eacute; agricole pr&eacute;hispanique qui, comme Pomp&eacute;i et Herculanum en Italie, fut brutalement engloutie par une &eacute;ruption du volcan Laguna Caldera vers 600. Gr&acirc;ce &agrave; leur parfait &eac";;;1993;;;-89.36916667;13.8275;3200;0;0;1;1;0;0;0;0;0;0;(iii)(iv);Cultural;C;"El Salvador";"El Salvador";"Latin America and the Caribbean";"Amérique latine et Caraïbes";sv;slv;0;13.8275,-89.36916667
1626;822;Bis;"Historic Centre (Old Town) of Tallinn";"Centre historique (vieille ville) de Tallin";"<p>The origins of Tallinn date back to the 13th century, when a castle was built there by the crusading knights of the Teutonic Order. It developed as a major centre of the Hanseatic League, and its wealth is demonstrated by the opulence of the public bui";"<p>Les origines de Tallin remontent au XIII<sup>e</sup> si&egrave;cle, lorsqu'un ch&acirc;teau fut &eacute;difi&eacute; par les crois&eacute;s de l'ordre Teutonique. La cit&eacute; s'est d&eacute;velopp&eacute;e pour devenir un poste cl&eacute; de la Ligu";"<p>The Committee decided to inscribe this property on the basis of <em>criteria (ii) and (iv)</em>, considering that Tallinn is an outstanding and exceptionally complete and well preserved example of a medieval northern European trading city that retains ";"<p>Le Comit&eacute; a d&eacute;cid&eacute; d'inscrire ce bien sur la base des <em>crit&egrave;res (ii) et (iv)</em>. Tallin constitue un exemple remarquable, exceptionnellement complet et bien conserv&eacute; d'une cit&eacute; m&eacute;di&eacute;vale comm";1997;;;24.73333333;59.43333;113;0;1;0;1;0;0;0;0;0;0;(ii)(iv);Cultural;C;Estonia;Estonie;"Europe and North America";"Europe et Amérique du nord";ee;est;0;59.43333,24.73333333
12;9;;"Simien National Park";"Parc national du Simien";"<p>Massive erosion over the years on the Ethiopian plateau has created one of the most spectacular landscapes in the world, with jagged mountain peaks, deep valleys and sharp precipices dropping some 1,500 m. The park is home to some extremely rare animal";"<p>Une érosion massive au cours des ans a formé sur le plateau éthiopien un des paysages les plus spectaculaires du monde, avec des pics, des vallées, et des précipices atteignant jusqu'à 1 500 m de profondeur. Le parc est le refuge d'animaux extrêmement ";;;1978;;"Y 1996";38.0666666667;13.1833333333;13600;0;0;0;0;0;0;1;0;0;1;(vii)(x);Natural;N;Ethiopia;Éthiopie;Africa;Afrique;et;eth;0;13.1833333333,38.0666666667
13;10;;"Lower Valley of the Awash";"Basse vallée de l'Aouache";"<p>The Awash valley contains one of the most important groupings of palaeontological sites on the African continent. The remains found at the site, the oldest of which date back at least 4 million years, provide evidence of human evolution which has modif";"<p>La vall&eacute;e de l'Aouache contient un des plus importants ensembles de gisements pal&eacute;ontologiques du continent africain. Les vestiges d&eacute;couverts sur le site, dont les plus anciens ont au moins 4 millions d'ann&eacute;es, fournissent u";;;1980;;;40.57939;11.10006;0;0;1;1;1;0;0;0;0;0;0;(ii)(iii)(iv);Cultural;C;Ethiopia;Éthiopie;Africa;Afrique;et;eth;0;11.10006,40.57939
15;12;;Tiya;Tiya;"<p>Tiya is among the most important of the roughly 160 archaeological sites discovered so far in the Soddo region, south of Addis Ababa. The site contains 36 monuments, including 32 carved stelae covered with symbols, most of which are difficult to deciph";"<p>Sur quelque 160 sites arch&eacute;ologiques d&eacute;couverts jusqu'&agrave; pr&eacute;sent dans la r&eacute;gion du Soddo, au sud d'Addis-Abeba, celui de Tiya est l'un des plus importants. Il comprend 36 monuments, dont 32 st&egrave;les pr&eacute;sent";;;1980;;;38.6121;8.43491;0;1;0;0;1;0;0;0;0;0;0;(i)(iv);Cultural;C;Ethiopia;Éthiopie;Africa;Afrique;et;eth;0;8.43491,38.6121
18;15;;Aksum;Axoum;"<p>The ruins of the ancient city of Aksum are found close to Ethiopia's northern border. They mark the location of the heart of ancient Ethiopia, when the Kingdom of Aksum was the most powerful state between the Eastern Roman Empire and Persia. The massiv";"<p>Près de la frontière nord de l'Éthiopie, les ruines de la ville ancienne d'Axoum marquent l'emplacement du cœur de l'Éthiopie antique, lorsque le royaume d'Axoum était l'État le plus puissant entre l'Empire romain d'Orient et la Perse. Les ruines massi";;;1980;;;38.71861;14.13019;0;1;0;0;1;0;0;0;0;0;0;(i)(iv);Cultural;C;Ethiopia;Éthiopie;Africa;Afrique;et;eth;0;14.13019,38.71861
20;17;;"Lower Valley of the Omo";"Basse vallée de l'Omo";"<p>A prehistoric site near Lake Turkana, the lower valley of the Omo is renowned the world over. The discovery of many fossils there, especially <em>Homo gracilis</em>, has been of fundamental importance in the study of human evolution.</p>";"<p>Pr&egrave;s du lac Turkana, la basse vall&eacute;e de l'Omo est un site pr&eacute;historique de renomm&eacute;e mondiale, o&ugrave; ont &eacute;t&eacute; d&eacute;couverts de nombreux fossiles, notamment l'<em>Homo gracilis</em>, d'une importance essen";;;1980;;;35.96666667;4.8;0;0;0;1;1;0;0;0;0;0;0;(iii)(iv);Cultural;C;Ethiopia;Éthiopie;Africa;Afrique;et;eth;0;4.8,35.96666667
21;18;;"Rock-Hewn Churches, Lalibela";"Églises creusées dans le roc de Lalibela";"<p>The 11 medieval monolithic cave churches of this 13th-century 'New Jerusalem' are situated in a mountainous region in the heart of Ethiopia near a traditional village with circular-shaped dwellings. Lalibela is a high place of Ethiopian Christianity, s";"<p>Au c&oelig;ur de l'&Eacute;thiopie, dans une r&eacute;gion montagneuse, les onze &eacute;glises monolithes m&eacute;di&eacute;vales de cette &laquo; nouvelle J&eacute;rusalem &raquo; du XIII<sup>e</sup> si&egrave;cle ont &eacute;t&eacute; creus&eacute;";;;1978;;;39.04042;12.02935;0;1;1;1;0;0;0;0;0;0;0;(i)(ii)(iii);Cultural;C;Ethiopia;Éthiopie;Africa;Afrique;et;eth;0;12.02935,39.04042
22;19;;"Fasil Ghebbi, Gondar Region";"Fasil Ghebi";"<p>In the 16th and 17th centuries, the fortress-city of Fasil Ghebbi was the residence of the Ethiopian emperor Fasilides and his successors. Surrounded by a 900-m-long wall, the city contains palaces, churches, monasteries and unique public and private b";"<p>R&eacute;sidence de l'empereur &eacute;thiopien Fasilid&egrave;s et de ses successeurs aux XVI<sup>e</sup> et XVII<sup>e</sup> si&egrave;cles, la ville fortifi&eacute;e de Fasil Ghebbi regroupe &agrave; l'int&eacute;rieur d'une enceinte de 900 m palais";;;1979;;;37.46617;12.60692;0;0;1;1;0;0;0;0;0;0;0;(ii)(iii);Cultural;C;Ethiopia;Éthiopie;Africa;Afrique;et;eth;0;12.60692,37.46617
1452;1189;rev;"Harar Jugol, the Fortified Historic Town";"Harar Jugol, la ville historique fortifiée";"<p>The fortified historic town of Harar is located in the eastern part of the country on a plateau with deep gorges surrounded by deserts and savannah. The walls surrounding this sacred Muslim city were built between the 13th and 16th centuries. Harar Jug";"<p>La ville fortifi&eacute;e de Harar est situ&eacute;e dans la partie orientale du pays, sur un plateau encercl&eacute; par le d&eacute;sert et la savane et entaill&eacute; par de profondes gorges. Les murs ceignant cette ville sacr&eacute;e musulmane on";;;2006;;;42.1377777777;9.3088888888;48;0;1;1;1;1;0;0;0;0;0;(ii)(iii)(iv)(v);Cultural;C;Ethiopia;Éthiopie;Africa;Afrique;et;eth;0;9.3088888888,42.1377777777
1846;1333;rev;"Konso Cultural Landscape";"Paysage culturel du pays konso";"<p>Konso Cultural Landscape is a 55km2 arid property of stone walled terraces and fortified settlements in the Konso highlands of Ethiopia. It constitutes a spectacular example of a living cultural tradition stretching back 21 generations (more than 400 y";"<p>Le Paysage culturel du pays konso est un site aride de 55 km&sup2;, avec des terrasses en pierre et des fortifications, situ&eacute; sur les hauts plateaux d'Ethiopie. Il constitue un exemple spectaculaire d'une tradition culturelle vivante remontant &";;;2011;;;37.4;5.3;23000;0;0;1;0;1;0;0;0;0;0;(iii)(v);Cultural;C;Ethiopia;Éthiopie;Africa;Afrique;et;eth;0;5.3,37.4
1886;1399;;"Levuka Historical Port Town";"Ville portuaire historique de Levuka";"<p>The town and its low line of buildings set among coconut and mango trees along the beach front was the first colonial capital of Fiji, ceded to the British in 1874. It developed from the early 19th century as a centre of commercial activity by American";"<p>La ville, avec sa ligne basse de b&acirc;timents au milieu des cocotiers et des manguiers du bord de mer, a &eacute;t&eacute; la premi&egrave;re capitale coloniale des Fidji, c&eacute;d&eacute;e aux Britanniques en 1874. Elle a prosp&eacute;r&eacute; &";;;2013;;;178.8345333333;-17.6833777778;69,6;0;1;0;1;0;0;0;0;0;0;(ii)(iv);Cultural;C;Fiji;Fidji;"Asia and the Pacific";"Asie et pacifique";fj;fji;0;-17.6833777778,178.8345333333
686;579;Rev;"Bronze Age Burial Site of Sammallahdenmäki";"Site funéraire de l'âge du bronze de Sammallahdenmäki";"<p>This Bronze Age burial site features more than 30 granite burial cairns, providing a unique insight into the funerary practices and social and religious structures of northern Europe more than three millennia ago.</p>";"<p>La trentaine de tumulus fun&eacute;raires en granit du cimeti&egrave;re de l'&acirc;ge du bronze de Sammallahdenm&auml;ki constituent un t&eacute;moignage exceptionnel des pratiques fun&eacute;raires et des structures sociales et religieuses de l'Europ";"<p><em>Criterion (iii):</em> The Sammallahdenm&auml;ki cairn cemetery bears exceptional witness to the society of the Bronze Age of Scandinavia.</p><p><em>Criterion (iv):</em> The Sammallahdenm&auml;ki cemetery is an outstanding example of Bronze Age fu";"<p><em>Crit&egrave;re (iii)&nbsp;:</em>&nbsp;Les cairns du cimeti&egrave;re de Sammallahdenm&auml;ki apportent un t&eacute;moignage exceptionnel sur la soci&eacute;t&eacute; de l&rsquo;&acirc;ge du bronze en Scandinavie.</p><p><em>Crit&egrave;re (iv) :&";1999;;;21.7775;61.12056;0;0;0;1;1;0;0;0;0;0;0;(iii)(iv);Cultural;C;Finland;Finlande;"Europe and North America";"Europe et Amérique du nord";fi;fin;0;61.12056,21.7775
1718;582;Bis;"Old Rauma";"Ancienne Rauma";"<p>Situated on the Gulf of Botnia, Rauma is one of the oldest harbours in Finland. Built around a Franciscan monastery, where the mid-15th-century Holy Cross Church still stands, it is an outstanding example of an old Nordic city constructed in wood. Alth";"<p>Situ&eacute;e sur le golfe de Botnie, la ville de Rauma est l'un des plus anciens ports de Finlande. Elle est construite autour d'un monast&egrave;re franciscain dont il reste l'&eacute;glise Sainte-Croix, qui date du milieu du XV<sup>e</sup> si&egrave";;;1991;;;21.51167;61.12806;29;0;0;0;1;1;0;0;0;0;0;(iv)(v);Cultural;C;Finland;Finlande;"Europe and North America";"Europe et Amérique du nord";fi;fin;0;61.12806,21.51167
690;583;;"Fortress of Suomenlinna";"Forteresse de Suomenlinna";"<p>Built in the second half of the 18th century by Sweden on a group of islands located at the entrance of Helsinki's harbour, this fortress is an especially interesting example of European military architecture of the time.</p>";"<p>Construite dans la seconde moitié du XVIII<sup>e</sup> siècle par les Suédois sur un groupe d'îles situées à l'entrée de la rade d'Helsinki, la forteresse constitue un exemple particulièrement intéressant de l'architecture militaire européenne de l'épo";;;1991;;;24.98722;60.14722;210;0;0;0;1;0;0;0;0;0;0;(iv);Cultural;C;Finland;Finlande;"Europe and North America";"Europe et Amérique du nord";fi;fin;0;60.14722,24.98722
691;584;;"Petäjävesi Old Church";"Vieille église de Petäjävesi";"<p>Pet&auml;j&auml;vesi Old Church, in central Finland, was built of logs between 1763 and 1765. This Lutheran country church is a typical example of an architectural tradition that is unique to eastern Scandinavia. It combines the Renaissance conception ";"<p>La vieille &eacute;glise de Pet&auml;j&auml;vesi, en Finlande centrale, construite en rondins de conif&egrave;res en 1763-1765, est une &eacute;glise luth&eacute;rienne rurale repr&eacute;sentative d'une tradition architecturale propre &agrave; l'est d";;;1994;;;25.18333;62.25;0;0;0;0;1;0;0;0;0;0;0;(iv);Cultural;C;Finland;Finlande;"Europe and North America";"Europe et Amérique du nord";fi;fin;0;62.25,25.18333
885;751;;"Verla Groundwood and Board Mill";"Usine de traitement du bois et de carton de Verla";"<p>The Verla groundwood and board mill and its associated residential area is an outstanding, remarkably well-preserved example of the small-scale rural industrial settlements associated with pulp, paper and board production that flourished in northern Eu";"<p>L&rsquo;usine de bois de Verla et le secteur r&eacute;sidentiel associ&eacute; sont un exemple exceptionnel et remarquablement bien conserv&eacute; d&rsquo;installation industrielle rurale de petite dimension consacr&eacute;e &agrave; la fabrication de";"<p>The Committee decided to inscribe the nominated property on the basis of cultural <em>criterion (iv)</em> considering that the Groundwood and Board Mill and its associated habitation is an outstanding and remarkably well preserved example of the small-";"<p>Le Comit&eacute; a d&eacute;cid&eacute; d'inscrire le bien propos&eacute; sur la base du <em>crit&egrave;re culturel(iv)</em>, consid&eacute;rant que l'usine de bois de Verla et le secteur r&eacute;sidentiel qui lui est associ&eacute; sont un exemple e";1996;;;26.64083;61.06194;22,778;0;0;0;1;0;0;0;0;0;0;(iv);Cultural;C;Finland;Finlande;"Europe and North America";"Europe et Amérique du nord";fi;fin;0;61.06194,26.64083
1569;80;Bis;"Mont-Saint-Michel and its Bay";"Mont-Saint-Michel et sa baie";"<p>Perched on a rocky islet in the midst of vast sandbanks exposed to powerful tides between Normandy and Brittany stand the 'Wonder of the West', a Gothic-style Benedictine abbey dedicated to the archangel St Michael, and the village that grew up in the ";"<p>Sur un îlot rocheux au milieu de grèves immenses soumises au va-et-vient de puissantes marées, à la limite entre la Normandie et la Bretagne, s'élèvent la « merveille de l'Occident », abbaye bénédictine de style gothique dédiée à l'archange saint Miche";;;1979;;;-1.51056;48.63556;6560;1;0;1;0;0;1;0;0;0;0;(i)(iii)(vi);Cultural;C;France;France;"Europe and North America";"Europe et Amérique du nord";fr;fra;0;48.63556,-1.51056
1719;81;Bis;"Chartres Cathedral";"Cathédrale de Chartres";"<p>Partly built starting in 1145, and then reconstructed over a 26-year period after the fire of 1194, Chartres Cathedral marks the high point of French Gothic art. The vast nave, in pure ogival style, the porches adorned with fine sculptures from the mid";"<p>Construite en partie &agrave; partir de 1145, et reconstruite en vingt-six ans apr&egrave;s l'incendie de 1194, la cath&eacute;drale de Chartres est le monument par excellence de l'art gothique fran&ccedil;ais. Sa vaste nef du plus pur style ogival, se";;;1979;;;1.487222222;48.4475;1,06;1;1;0;1;0;0;0;0;0;0;(i)(ii)(iv);Cultural;C;France;France;"Europe and North America";"Europe et Amérique du nord";fr;fra;0;48.4475,1.487222222
1571;83;Bis;"Palace and Park of Versailles";"Palais et parc de Versailles";"<p>The Palace of Versailles was the principal residence of the French kings from the time of Louis XIV to Louis XVI. Embellished by several generations of architects, sculptors, decorators and landscape architects, it provided Europe with a model of the i";"<p>Lieu de r&eacute;sidence privil&eacute;gi&eacute; de la monarchie fran&ccedil;aise de Louis XIV &agrave; Louis XVI, le ch&acirc;teau de Versailles, embelli par plusieurs g&eacute;n&eacute;rations d'architectes, de sculpteurs, d'ornemanistes et de paysa";;;1979;;;2.119444444;48.805;1070;1;1;0;0;0;1;0;0;0;0;(i)(ii)(vi);Cultural;C;France;France;"Europe and North America";"Europe et Amérique du nord";fr;fra;0;48.805,2.119444444
1572;84;Bis;"Vézelay, Church and Hill";"Basilique et colline de Vézelay";"<p>Shortly after its foundation in the 9th century, the Benedictine abbey of V&eacute;zelay acquired the relics of St Mary Magdalene and since then it has been an important place of pilgrimage. St Bernard preached the Second Crusade there in 1146 and Rich";"<p>Peu apr&egrave;s sa fondation au IXe si&egrave;cle, le monast&egrave;re b&eacute;n&eacute;dictin a acquis les reliques de sainte Marie-Madeleine et devint, depuis lors, un haut lieu de p&egrave;lerinage. Saint Bernard y pr&ecirc;cha la deuxi&egrave;me ";;;1979;;;3.748333333;47.46638889;183;1;0;0;0;0;1;0;0;0;0;(i)(vi);Cultural;C;France;France;"Europe and North America";"Europe et Amérique du nord";fr;fra;0;47.46638889,3.748333333
91;85;;"Prehistoric Sites and Decorated Caves of the Vézère Valley";"Sites préhistoriques et grottes ornées de la vallée de la Vézère";"<p>The Vézère valley contains 147 prehistoric sites dating from the Palaeolithic and 25 decorated caves. It is particularly interesting from an ethnological and anthropological, as well as an aesthetic point of view because of its cave paintings, especial";"<p>Le site préhistorique de la vallée de la Vézère comporte 147 gisements remontant jusqu'au paléolithique et 25 grottes ornées. Il présente un intérêt exceptionnel d'un point de vue ethnologique, anthropologique et esthétique avec ses peintures pariétale";;;1979;;;1.17;45.0575;0;1;0;1;0;0;0;0;0;0;0;(i)(iii);Cultural;C;France;France;"Europe and North America";"Europe et Amérique du nord";fr;fra;0;45.0575,1.17
178;160;;"Palace and Park of Fontainebleau";"Palais et parc de Fontainebleau";"<p>Used by the kings of France from the 12th century, the medieval royal hunting lodge of Fontainebleau, standing at the heart of a vast forest in the Ile-de-France, was transformed, enlarged and embellished in the 16th century by Fran&ccedil;ois I, who w";"<p>Utilis&eacute;e par les rois de France d&egrave;s le XII<sup>e</sup> si&egrave;cle, la r&eacute;sidence de chasse de Fontainebleau, au c&oelig;ur d'une grande for&ecirc;t de l'&Icirc;le-de-France, fut transform&eacute;e, agrandie et embellie au XVI<sup";;;1981;;;2.698055556;48.40194444;144;0;1;0;0;0;1;0;0;0;0;(ii)(vi);Cultural;C;France;France;"Europe and North America";"Europe et Amérique du nord";fr;fra;0;48.40194444,2.698055556
1951;162;Bis;"Amiens Cathedral";"Cathédrale d'Amiens";"<p>Amiens Cathedral, in the heart of Picardy, is one of the largest 'classic' Gothic churches of the 13th century. It is notable for the coherence of its plan, the beauty of its three-tier interior elevation and the particularly fine display of sculptures";"<p>La cath&eacute;drale d'Amiens, au c&oelig;ur de la Picardie, est l'une des plus grandes &eacute;glises gothiques &laquo; classiques &raquo; du XIII<sup>e</sup> si&egrave;cle. Elle frappe par la coh&eacute;rence du plan, la beaut&eacute; de l'&eacute;l&";;;1981;;;2.301666667;49.895;1,54;1;1;0;0;0;0;0;0;0;0;(i)(ii);Cultural;C;France;France;"Europe and North America";"Europe et Amérique du nord";fr;fra;0;49.895,2.301666667
1568;163;Bis;"Roman Theatre and its Surroundings and the ""Triumphal Arch"" of Orange";"Théâtre antique et ses abords et « Arc de Triomphe » d'Orange";"<p>Situated in the Rhone valley, the ancient theatre of Orange, with its 103-m-long facade, is one of the best preserved of all the great Roman theatres. Built between A.D. 10 and 25, the Roman arch is one of the most beautiful and interesting surviving e";"<p>Dans la vall&eacute;e du Rh&ocirc;ne, le th&eacute;&acirc;tre antique d'Orange, avec son mur de fa&ccedil;ade de 103 m de long, est l'un des mieux conserv&eacute;s des grands th&eacute;&acirc;tres romains. Construit entre 10 et 25, l'arc de triomphe ro";;;1981;;;4.808416667;44.13572222;9,45;0;0;1;0;0;1;0;0;0;0;(iii)(vi);Cultural;C;France;France;"Europe and North America";"Europe et Amérique du nord";fr;fra;0;44.13572222,4.808416667
182;164;;"Arles, Roman and Romanesque Monuments";"Arles, monuments romains et romans";"<p>Arles is a good example of the adaptation of an ancient city to medieval European civilization. It has some impressive Roman monuments, of which the earliest – the arena, the Roman theatre and the cryptoporticus (subterranean galleries) – date back to ";"<p>Arles offre un exemple intéressant d'adaptation d'une cité antique à la civilisation de l'Europe médiévale. Elle conserve d'impressionnants monuments romains dont les plus anciens – arènes, théâtre antique, cryptoportiques – remontent au I<sup><sup>e</";;;1981;;;4.630694444;43.67763889;65;0;1;0;1;0;0;0;0;0;0;(ii)(iv);Cultural;C;France;France;"Europe and North America";"Europe et Amérique du nord";fr;fra;0;43.67763889,4.630694444
1565;165;Bis;"Cistercian Abbey of Fontenay";"Abbaye cistercienne de Fontenay";"<p>This stark Burgundian monastery was founded by St Bernard in 1119. With its church, cloister, refectory, sleeping quarters, bakery and ironworks, it is an excellent illustration of the ideal of self-sufficiency as practised by the earliest communities ";"<p>Fond&eacute;e en 1119 par saint Bernard, l'abbaye bourguignonne de Fontenay, &agrave; l'architecture d&eacute;pouill&eacute;e, avec son &eacute;glise, son clo&icirc;tre, son r&eacute;fectoire, son dortoir, sa boulangerie et sa forge, illustre bien l'id";;;1981;;;4.38911;47.63944;5,77;0;0;0;1;0;0;0;0;0;0;(iv);Cultural;C;France;France;"Europe and North America";"Europe et Amérique du nord";fr;fra;0;47.63944,4.38911
1637;203;Bis;"From the Great Saltworks of Salins-les-Bains to the Royal Saltworks of Arc-et-Senans, the Production of Open-pan Salt ";"De la grande saline de Salins-les-Bains à la saline royale d’Arc-et-Senans, la production du sel ignigène ";"<p>The Royal Saltworks of Arc-et-Senans, near Besan&ccedil;on, was built by Claude Nicolas Ledoux. Its construction, begun in 1775 during the reign of Louis XVI, was the first major achievement of industrial architecture, reflecting the ideal of progress ";"<p>La Saline Royale d'Arc-et-Senans, &agrave; proximit&eacute; de Besan&ccedil;on, est l'&oelig;uvre de Claude Nicolas Ledoux. Sa construction, qui d&eacute;buta en 1775 sous le r&egrave;gne de Louis XVI, est la premi&egrave;re grande r&eacute;alisation d";;;1982;2009;;5.8763888889;46.9375;10,48;1;1;0;1;0;0;0;0;0;0;(i)(ii)(iv);Cultural;C;France;France;"Europe and North America";"Europe et Amérique du nord";fr;fra;0;46.9375,5.8763888889
254;228;rev;"Historic Centre of Avignon: Papal Palace, Episcopal Ensemble and Avignon Bridge";"Centre historique d’Avignon : Palais des papes, ensemble épiscopal et Pont d’Avignon";"<p>In the 14th century, this city in the South of France was the seat of the papacy. The Palais des Papes, an austere-looking fortress lavishly decorated by Simone Martini and Matteo Giovanetti, dominates the city, the surrounding ramparts and the remains";"<p>Cette ville du midi de la France fut le si&egrave;ge de la papaut&eacute; au XIV<sup>e</sup> si&egrave;cle. Le palais des Papes, forteresse d'apparence aust&egrave;re somptueusement d&eacute;cor&eacute;e &agrave; l'int&eacute;rieur par Simone Martini e";;;1995;;;4.806111111;43.95277778;8,2;1;1;0;1;0;0;0;0;0;0;(i)(ii)(iv);Cultural;C;France;France;"Europe and North America";"Europe et Amérique du nord";fr;fra;0;43.95277778,4.806111111
2186;229;;"Place Stanislas, Place de la Carrière and Place d'Alliance in Nancy";"Places Stanislas, de la Carrière et d'Alliance à Nancy";"<p>Nancy, the temporary residence of a king without a kingdom – Stanislas Leszczynski, later to become Duke of Lorraine – is paradoxically the oldest and most typical example of a modern capital where an enlightened monarch proved to be sensitive to the n";"<p>Nancy, résidence temporaire d'un roi sans royaume devenu duc de Lorraine, Stanislas Leszczynski, est paradoxalement l'exemple le plus ancien et le plus typique d'une capitale moderne où un monarque éclairé se montre soucieux d'utilité publique. Réalisé";;;1983;;;6.183333333;48.69361111;7;1;0;0;1;0;0;0;0;0;0;(i)(iv);Cultural;C;France;France;"Europe and North America";"Europe et Amérique du nord";fr;fra;0;48.69361111,6.183333333
2118;230;;"Abbey Church of Saint-Savin sur Gartempe";"Abbatiale de Saint-Savin sur Gartempe";"<p>Known as the 'Romanesque Sistine Chapel', the Abbey-Church of Saint-Savin contains many beautiful 11th- and 12th-century murals which are still in a remarkable state of preservation.</p>";"<p>Surnommée la « Sixtine romane », l'abbaye poitevine de Saint-Savin est décorée de très nombreuses et très belles peintures murales des XI<sup>e</sup> et XII<sup>e</sup> siècles qui nous sont parvenues dans un état de fraîcheur remarquable.</p>";;;1983;;;0.86611;46.56472;1,61;1;0;1;0;0;0;0;0;0;0;(i)(iii);Cultural;C;France;France;"Europe and North America";"Europe et Amérique du nord";fr;fra;0;46.56472,0.86611
