id;id_no;rev_bis;name_en;name_fr;short_description_en;short_description_fr;justification_en;justification_fr;date_inscribed;secondary_dates;danger_list;longitude;latitude;area_hectares;C1;C2;C3;C4;C5;C6;N7;N8;N9;N10;criteria_txt;category;category_short;states_name_en;states_name_fr;continent_name_en;continent_name_fr;iso_code;udnp_code;transboundary;coordonnees
904;766;Rev;"Central Sikhote-Alin";"Sikhote-Aline central";"<p>The Sikhote-Alin mountain range contains one the richest and most unusual temperate forests of the world. In this mixed zone between taiga and subtropics, southern species such as the tiger and Himalayan bear cohabit with northern species such as the b";"<p>La cha&icirc;ne de montagnes de Sikhote-Alin abrite l&rsquo;une des for&ecirc;ts temp&eacute;r&eacute;es les plus riches et les plus insolites du monde. C&rsquo;est une zone mixte entre la ta&iuml;ga et les r&eacute;gions subtropicales o&ugrave; des es";"<p><em>Criterion (x):</em> The nominated area is representative of one of the world&rsquo;s most distinctive natural regions. The combination of glacial history, climate and relief has allowed the development of the richest and most unusual temperate fore";"<p><em>Crit&egrave;re (x) :</em> Le site propos&eacute; est repr&eacute;sentatif de l&rsquo;une des r&eacute;gions naturelles les plus particuli&egrave;res du monde. L&rsquo;association de l&rsquo;histoire glaciaire, du climat et du relief a favoris&eacut";2001;;;136.1666667;45.33333333;406177;0;0;0;0;0;0;0;0;0;1;(x);Natural;N;"Russian Federation";"Fédération de Russie";"Europe and North America";"Europe et Amérique du nord";ru;rus;0;45.33333333,136.1666667
907;768;rev;"Golden Mountains of Altai";"Montagnes dorées de l'Altaï";"<p>The Altai mountains in southern Siberia form the major mountain range in the western Siberia biogeographic region and provide the source of its greatest rivers – the Ob and the Irtysh. Three separate areas are inscribed: Altaisky Zapovednik and a buffe";"<p>L'Altaï, dans le sud de la Sibérie, est la principale chaîne de montagnes de la région biogéographique de Sibérie occidentale où prennent naissance les principaux cours d'eau de cette région – l'Ob et l'Irtych. Le site comprend trois aires distinctes :";"<p><em>Criteria (x)</em>: The Altai region represents an important and original centre of biodiversity of montane plant and animal species in northern Asia, a number of which are rare and endemic.</p>";"<p><em>Critère (x)</em> : La région de l’Altai est un centre important et régional de la biodiversité des plantes et des espèces animales.</p>";1998;;;86;50.46666667;1611457;0;0;0;0;0;0;0;0;0;1;(x);Natural;N;"Russian Federation";"Fédération de Russie";"Europe and North America";"Europe et Amérique du nord";ru;rus;0;50.46666667,86
1052;900;;"Western Caucasus";"Caucase de l'Ouest";"<p>The Western Caucasus, extending over 275,000 ha of the extreme western end of the Caucasus mountains and located 50 km north-east of the Black Sea, is one of the few large mountain areas of Europe that has not experienced significant human impact. Its ";"<p>Situé à une distance de 50 km au nord-est de la mer Noire et couvrant plus de 275 000 ha, le site du Caucase de l'Ouest est l'une des rares grandes régions de montagne d'Europe qui n'ait pas subi d'importants impacts humains. Ses pâturages subalpins et";"<p>The Western Caucasus has a remarkable diversity of geology, ecosystems and species. It is of global significance as a centre of plant diversity. Along with the Virgin Komi World Heritage site, it is the only large mountain area in Europe that has not e";"<p>Le Caucase de l’Ouest a une diversité remarquable en géologie, écosystèmes et espèces. Il a une importance globale comme centre de la diversité des plantes. Avec le site des Forêts vierges de Komi, il s’agit de la seule très grande zone de montagnes en";1999;;;40;44;298903;0;0;0;0;0;0;0;0;1;1;(ix)(x);Natural;N;"Russian Federation";"Fédération de Russie";"Europe and North America";"Europe et Amérique du nord";ru;rus;0;44,40
1144;980;;"Historic and Architectural Complex of the Kazan Kremlin";"Ensemble historique et architectural du Kremlin de Kazan";"<p>Built on an ancient site, the Kazan Kremlin dates from the Muslim period of the Golden Horde and the Kazan Khanate. It was conquered by Ivan the Terrible in 1552 and became the Christian See of the Volga Land. The only surviving Tatar fortress in Russi";"<p>Construit sur un site antique, le Kremlin de Kazan remonte &agrave; la p&eacute;riode musulmane de la Horde d'or et du khanat de Kazan. Il fut conquis par Ivan le Terrible en 1552 et devint le centre chr&eacute;tien des pays de la Volga. Seule forteres";"<p><em>Criterion (ii):</em> The Kazan Kremlin complex represents exceptional testimony of historical continuity and cultural diversity over a long period of time, resulting in an important interchange of values generated by the different cultures.</p><p";"<p><em>Crit&egrave;re (ii) :</em> L&rsquo;ensemble du Kremlin de Kazan constitue un t&eacute;moignage exceptionnel de continuit&eacute; historique et de diversit&eacute; culturelle sur une longue p&eacute;riode qui r&eacute;sulte d&rsquo;un important &eac";2000;;;49.095;55.79111111;13,45;0;1;1;1;0;0;0;0;0;0;(ii)(iii)(iv);Cultural;C;"Russian Federation";"Fédération de Russie";"Europe and North America";"Europe et Amérique du nord";ru;rus;0;55.79111111,49.095
2009;981;Rev;"Bolgar Historical and Archaeological Complex";"L’ensemble historique et archéologique de Bolgar";"<p>This property lies on the shores of the Volga River, south of its confluence with the River Kama, and south of the capital of Tatarstan, Kazan. It contains evidence of the medieval city of Bolgar, an early settlement of the civilization of Volga-Bolgar";"<p>Situ&eacute; sur les rives de la Volga, au sud de sa confluence avec la rivi&egrave;re Kama et de la capitale du Tatarstan, Kazan, Bolgar est un &eacute;tablissement de la civilisation nomade des Bulgares de la Volga &ndash; qui exista du VII<sup>e</su";;;2014;;;49.0563888889;54.9788888889;424;0;1;0;0;0;1;0;0;0;0;(ii)(vi);Cultural;C;"Russian Federation";"Fédération de Russie";"Europe and North America";"Europe et Amérique du nord";ru;rus;0;54.9788888889,49.0563888889
1146;982;;"Ensemble of the Ferapontov Monastery";"Ensemble du monastère de Ferapontov";"<p>The Ferapontov Monastery, in the Vologda region in northern Russia, is an exceptionally well-preserved and complete example of a Russian Orthodox monastic complex of the 15th-17th centuries, a period of great significance in the development of the unif";"<p>Le monastère de Ferapontov est situé dans la région de Vologda, en Russie septentrionale. C'est un exemple exceptionnellement bien conservé et complet d'un ensemble monastique russe orthodoxe des XV<sup>e</sup> -XVII<sup>e</sup> siècles, période d'une ";"<p><em>Criterion (i):</em> The wall paintings of Dionisy in the Cathedral of the Nativity of the Virgin at Ferapontov Monastery are the highest expression of Russian mural art in the 15th-16th centuries.</p><p><em>Criterion (iv):</em> The complex of Fer";"<p><em>Critère (i) :</em> Les peintures murales de Dionisii, dans la cathédrale de la Nativité de la Vierge au monastère de Ferapontov, sont l’expression de l’art mural russe à son apogée, aux XVe-XVIe siècles.</p><p><em>Critère (iv) :</em> L’ensemble d";2000;;;38.56666667;59.95;2,1;1;0;0;1;0;0;0;0;0;0;(i)(iv);Cultural;C;"Russian Federation";"Fédération de Russie";"Europe and North America";"Europe et Amérique du nord";ru;rus;0;59.95,38.56666667
1194;1023;Rev;"Natural System of Wrangel Island Reserve";"Système naturel de la Réserve de l'île Wrangel";"<p>Located well above the Arctic Circle, the site includes the mountainous Wrangel Island (7,608 km2), Herald Island (11 km<sup>2</sup>) and surrounding waters. Wrangel was not glaciated during the Quaternary Ice Age, resulting in exceptionally high level";"<p>Situé nettement au-dessus du cercle arctique, le site comprend la montagneuse île Wrangel (7 608 km2), l’île Gerald (11 km2) et une zone maritime. Wrangel n’a pas été recouverte de glaces durant l’âge glaciaire du quaternaire, ce qui lui a permis de co";"<p><em>Criterion (ix):</em> The Wrangel Island Reserve is a self-contained island ecosystem and there is ample evidence that it has undergone a long evolutionary process uninterrupted by the glaciation that swept most other parts of the Arctic during the ";"<p><em>Critère (ix) :</em> La Réserve de l’île Wrangel est un écosystème insulaire autonome et il est clair qu’il a subi un long processus d’évolution ininterrompu par la glaciation qui a recouvert la majeure partie de l’Arctique durant le Quaternaire. Le";2004;;;-179.7152778;71.18888889;1916300;0;0;0;0;0;0;0;0;1;1;(ix)(x);Natural;N;"Russian Federation";"Fédération de Russie";"Europe and North America";"Europe et Amérique du nord";ru;rus;0;71.18888889,-179.7152778
1247;1070;;"Citadel, Ancient City and Fortress Buildings of Derbent";"Citadelle, vieille ville et forteresse de Derbent";"<p>The Citadel, Ancient City and Fortress Buildings of Derbent were part of the northern lines of the Sasanian Persian Empire, which extended east and west of the Caspian Sea. The fortification was built in stone. It consisted of two parallel walls that f";"<p>La citadelle, la vieille ville et la forteresse de Derbent faisaient partie du <em>limes</em> nord de l&rsquo;Empire perse sassanide, qui s&rsquo;&eacute;tendait &agrave; l&rsquo;est et &agrave; l&rsquo;ouest de la mer Caspienne. Les fortifications en ";"<p><em>Criterion (iii):</em> The site of the ancient city of Derbent has been crucial for the control of the north-south passage on the west side of the Caspian Sea since the 1st millennium BCE. The defence structures that were built by the Sasanians in t";"<p><em>Crit&egrave;re (iii) :</em> Le site de la vieille ville de Derbent a jou&eacute; un r&ocirc;le crucial pour le contr&ocirc;le du passage nord-sud &agrave; l&rsquo;ouest de la mer Caspienne depuis le premier mill&eacute;naire avant J.-C. Les structu";2003;;;48.29719444;42.05297222;9,7;0;0;1;1;0;0;0;0;0;0;(iii)(iv);Cultural;C;"Russian Federation";"Fédération de Russie";"Europe and North America";"Europe et Amérique du nord";ru;rus;0;42.05297222,48.29719444
1275;1097;;"Ensemble of the Novodevichy Convent";"Ensemble du couvent Novodievitchi";"<p>The Novodevichy Convent, in south-western Moscow, built in the 16th and 17th centuries in the so-called Moscow Baroque style, was part of a chain of monastic ensembles that were integrated into the defence system of the city. The convent was directly a";"<p>Le couvent Novodievitchi, au sud-ouest de Moscou, fut &eacute;difi&eacute; durant le XVIe et le XVIIe si&egrave;cle dans le style baroque moscovite. Il faisait partie d&rsquo;un ensemble monastique s&rsquo;inscrivant dans le syst&egrave;me de d&eacute;";"<p><em>Criterion (i):</em> The Novodevichy Convent is the most outstanding example of the so-called &lsquo;Moscow Baroque&rsquo;, which became a fashionable style in the region of Moscow. Apart form its fine architecture and decorative details, the site i";"<p><em>Crit&egrave;re (i) :</em> Le couvent Novodievitchi est l&rsquo;exemple le plus exceptionnel qui soit du style dit &laquo; baroque moscovite &raquo;, &agrave; la mode dans la r&eacute;gion de Moscou. Outre sa magnifique architecture et ses d&eacute;";2004;;;37.55508333;55.72611111;5,18;1;0;0;1;0;1;0;0;0;0;(i)(iv)(vi);Cultural;C;"Russian Federation";"Fédération de Russie";"Europe and North America";"Europe et Amérique du nord";ru;rus;0;55.72611111,37.55508333
1347;1170;;"Historical Centre of the City of Yaroslavl";"Centre historique de la ville de Yaroslavl";"<p>Situated at the confluence of the Volga and Kotorosl Rivers some 250 km north-east of Moscow, the historic city of Yaroslavl developed into a major commercial centre from the 11th century. It is renowned for its numerous 17th-century churches and is an";"<p>La ville historique de Yaroslavl est situ&eacute;e au confluent de la Volga et de la Kotorosl, &agrave; quelque 250 km au nord-est de Moscou. &Agrave; partir du XIe si&egrave;cle, elle devint un centre de commerce tr&egrave;s important. Elle est c&eacu";"<p><em>Criterion (ii): </em>The historic town of Yaroslavl with its 17th century churches and its Neo-classical radial urban plan and civic architecture is an outstanding example of the interchange of cultural and architectural influences between Western ";"<p><em>Crit&egrave;re (ii) : </em>La ville historique de Yaroslavl, avec ses &eacute;glises du XVIIe si&egrave;cle, son plan n&eacute;oclassique en &eacute;toile et son architecture civile, est un exemple exceptionnel de l&rsquo;&eacute;change d&rsquo;inf";2005;;;39.87611;57.65278;110;0;1;0;1;0;0;0;0;0;0;(ii)(iv);Cultural;C;"Russian Federation";"Fédération de Russie";"Europe and North America";"Europe et Amérique du nord";ru;rus;0;57.65278,39.87611
1644;1234;Rev;"Putorana Plateau";"Plateau de Putorana";"<p>This site coincides with the area of the Putoransky State Nature Reserve, and is located in the central part of the Putorana Plateau in northern Central Siberia. It is situated about 100 km north of the Arctic Circle. The part of the plateau inscribed ";"<p>Ce site, qui co&iuml;ncide avec la R&eacute;serve naturelle d'Etat de Putorana, se trouve dans la partie septentrionale de la Sib&eacute;rie centrale, &agrave; une centaine de kilom&egrave;tres au nord du cercle polaire. La partie du Plateau inscrite s";;;2010;;;94.1580555556;69.0469444444;1887251;0;0;0;0;0;0;1;0;1;0;(vii)(ix);Natural;N;"Russian Federation";"Fédération de Russie";"Europe and North America";"Europe et Amérique du nord";ru;rus;0;69.0469444444,94.1580555556
2116;1299;;"Lena Pillars Nature Park";"Parc naturel des colonnes de la Lena";"<p>Lena Pillars Nature Park is marked by spectacular rock pillars that reach a height of approximately 100 m along the banks of the Lena River in the central part of the Sakha Republic (Yakutia). They were produced by the region’s extreme continental clim";"<p>Le parc naturel des colonnes de la Lena est marqué par de spectaculaires colonnes de pierre d’une hauteur de près de 100 mètres qui longent les rives de la Lena, au centre de la République de Sakha (Yakoutie). Les colonnes sont nées du climat continent";;;2012;;;127;60.6666666667;1387000;0;0;0;0;0;0;0;1;0;0;(viii);Natural;N;"Russian Federation";"Fédération de Russie";"Europe and North America";"Europe et Amérique du nord";ru;rus;0;60.6666666667,127
1063;910;;"Brimstone Hill Fortress National Park";"Parc national de la forteresse de Brimstone Hill";"<p>Brimstone Hill Fortress National Park is an outstanding, well-preserved example of 17th- and 18th-century military architecture in a Caribbean context. Designed by the British and built by African slave labour, the fortress is testimony to European col";"<p>La forteresse de Brimstone Hill est un exemple remarquable et bien pr&eacute;serv&eacute; de l'architecture militaire des XVII<sup>e</sup> et XVIII<sup>e</sup> si&egrave;cles en milieu cara&iuml;be. Con&ccedil;ue par les Britanniques et construite par ";"<p>Criterion (iii): Brimstone Hill is an outstanding British fortress, built by slave labour to exact standards during a peak period of European colonial expansion in the Caribbean. Criterion (iv): Because of its strategic layout and construction, Brimsto";"<p>Crit&egrave;re iii Brimstone Hill est une forteresse britannique exceptionnelle, construite par des esclaves selon des normes pr&eacute;cises, &agrave; l&rsquo;apog&eacute;e de l&rsquo;expansion coloniale europ&eacute;enne aux Cara&iuml;bes. Crit&egrav";1999;;;-62.83722;17.34694;15,37;0;0;1;1;0;0;0;0;0;0;(iii)(iv);Cultural;C;"Saint Kitts and Nevis";Saint-Kitts-et-Nevis;"Latin America and the Caribbean";"Amérique latine et Caraïbes";kn;kna;0;17.34694,-62.83722
1341;1161;;"Pitons Management Area";"Zone de gestion des Pitons";"<p>The 2,909-ha site near the town of Soufriere includes the Pitons, two volcanic spires rising side by side from the sea (770 m and 743 m high respectively), linked by the Piton Mitan ridge. The volcanic complex includes a geothermal field with sulphurou";"<p>Le site de 2 909 ha, proche de la ville de Soufri&egrave;re, comprend les Pitons, deux aiguilles volcaniques jaillissant, c&ocirc;te &agrave; c&ocirc;te, de la mer (respectivement &agrave; 770 m et 743 m de hauteur). Gros Piton et Petit Piton sont reli";"<p><em>Criterion (viii):</em> The Pitons Management Area contains the greater part of a collapsed stratovolcano contained within the volcanic system, known to geologists as the Soufriere Volcanic Centre. Prominent within the volcanic landscape are two ero";"<p><em>Crit&egrave;re (viiii) :</em> La Zone de gestion des Pitons renferme la plus grande partie d&rsquo;un strato-volcan &eacute;croul&eacute; maintenu dans le syst&egrave;me volcanique, connu par les g&eacute;ologues sous le nom de Centre volcanique de";2004;;;-61.07036111;13.80708333;2909;0;0;0;0;0;0;1;1;0;0;(vii)(viii);Natural;N;"Saint Lucia";Sainte-Lucie;"Latin America and the Caribbean";"Amérique latine et Caraïbes";lc;lca;0;13.80708333,-61.07036111
1535;1245;;"San Marino Historic Centre and Mount Titano";"Centre historique de Saint-Marin et mont Titano";"<p>San Marino Historic Centre and Mount Titano covers 55 ha, including Mount Titano and the historic centre of the city which dates back to the foundation of the republic as a city-state in the 13th century. San Marino is inscribed as a testimony to the c";"<p>Le centre historique de Saint-Marin et mont Titano couvre 55 hectares et comprend le mont Titano et le centre historique de la cité de Saint-Marin qui remonte à la fondation de la république en tant que cité-État au XIIIème siècle. Saint-Marin est insc";;;2008;;;12.4519444444;43.9327777778;55;0;0;1;0;0;0;0;0;0;0;(iii);Cultural;C;"San Marino";Saint-Marin;"Europe and North America";"Europe et Amérique du nord";sm;smr;0;43.9327777778,12.4519444444
1524;1293;;"Al-Hijr Archaeological Site (Madâin Sâlih)";"Site archéologique de Al-Hijr (Madain Salih)";"<p>The Archaeological Site of Al-Hijr (Madâin Sâlih) is the first World Heritage property to be inscribed in Saudi Arabia. Formerly known as Hegra it is the largest conserved site of the civilization of the Nabataeans south of Petra in Jordan. It features";"<p>Le Site archéologique de Al-Hijr (Madain Salih), est le premier site de ce pays inscrit sur la Liste du patrimoine mondial. Anciennement appelé Hegra, il s’agit du plus important site conservé de la civilisation des Nabatéens au sud de Pétra (Jordanie)";;;2008;;;37.955;26.7836111111;1621,2;0;1;1;0;0;0;0;0;0;0;(ii)(iii);Cultural;C;"Saudi Arabia";"Arabie saoudite";"Arab States";"États arabes";sa;sau;0;26.7836111111,37.955
1659;1329;;"At-Turaif District in ad-Dir'iyah";"District d’at-Turaif à ad-Dir’iyah";"<p>This property was the first capital of the Saudi Dynasty, in the heart of the Arabian Penisula, north-west of Riyadh. Founded in the 15th century, it bears witness to the Najdi architectural style, which is specific to the centre of the Arabian peninsu";"<p>Ce site fut la premi&egrave;re capitale de la dynastie saoudienne, dans le centre de la p&eacute;ninsule arabique, au nord-ouest de Ryad. Fond&eacute;e au 15e si&egrave;cle, elle t&eacute;moigne du style architectural Nadji, propre au c&oelig;ur de la ";;;2010;;;46.5724666667;24.7341333333;28,78;0;0;0;1;1;1;0;0;0;0;(iv)(v)(vi);Cultural;C;"Saudi Arabia";"Arabie saoudite";"Arab States";"États arabes";sa;sau;0;24.7341333333,46.5724666667
1968;1361;;"Historic Jeddah, the Gate to Makkah";"Ville historique de Djeddah, la porte de La Mecque";"<p>Historic Jeddah is situated on the eastern shore of the Red Sea. From the 7th century AD it was established as a major port for Indian Ocean trade routes, channelling goods to Mecca. It was also the gateway for Muslim pilgrims to Mecca who arrived by s";"<p>Sur la rive orientale de la mer Rouge, Djedda a été à partir du VII<sup>e</sup> siècle l’un des ports les plus importants sur les routes commerciales de l’océan Indien. C’est ici qu’arrivaient les marchandises à destination de La Mecque. C’était aussi ";;;2014;;;39.1875;21.4838888889;17,92;0;1;0;1;0;1;0;0;0;0;(ii)(iv)(vi);Cultural;C;"Saudi Arabia";"Arabie saoudite";"Arab States";"États arabes";sa;sau;0;21.4838888889,39.1875
2033;1472;;"Rock Art in the Hail Region of Saudi Arabia";"Art rupestre de la région de Hail en Arabie saoudite";"<p><span>This property includes two components situated in a desert landscape: Jabel Umm Sinman at Jubbah and the Jabal al-Manjor and Raat at Shuwaymis. A lake once situated at the foot of the Umm Sinman hill range that has now disappeared used to be a so";"<p><strong> </strong><span>Ce bien en série est composé de deux sites au paysage désertique : le djebel Umm Sinman à Jubbah et les djebels al-Manjor et Raat à Shuwaymis. La chaîne de collines d’Umm Sinman surplombe un lac d’eau douce, aujourd’hui disparu,";;;2015;;;40.9130555556;28.0105555556;2043,8;1;0;1;0;0;0;0;0;0;0;(i)(iii);Cultural;C;"Saudi Arabia";"Arabie saoudite";"Arab States";"États arabes";sa;sau;0;28.0105555556,40.9130555556
28;25;;"Djoudj National Bird Sanctuary";"Parc national des oiseaux du Djoudj";"<p>Situated in the Senegal River delta, the Djoudj Sanctuary is a wetland of 16,000 ha, comprising a large lake surrounded by streams, ponds and backwaters. It forms a living but fragile sanctuary for some 1.5 million birds, such as the white pelican, the";"<p>Dans le delta du fleuve S&eacute;n&eacute;gal, le parc est une zone humide de 16 000 ha comprenant un grand lac entour&eacute; de ruisseaux, d&rsquo;&eacute;tangs et de bras morts, qui constituent un sanctuaire vital, mais fragile, pour un million et d";;;1981;;"P 2000-2006 P 1984-1988";-16.16667;16.5;16000;0;0;0;0;0;0;1;0;0;1;(vii)(x);Natural;N;Senegal;Sénégal;Africa;Afrique;sn;sen;0;16.5,-16.16667
29;26;;"Island of Gorée";"Île de Gorée";"<p>The island of Gor&eacute;e lies off the coast of Senegal, opposite Dakar. From the 15th to the 19th century, it was the largest slave-trading centre on the African coast. Ruled in succession by the Portuguese, Dutch, English and French, its architectur";"<p>Au large des c&ocirc;tes du S&eacute;n&eacute;gal, en face de Dakar, Gor&eacute;e a &eacute;t&eacute; du XV<sup>e</sup> au XIX<sup>e</sup> si&egrave;cle le plus grand centre de commerce d'esclaves de la c&ocirc;te africaine. Tour &agrave; tour sous dom";;;1978;;;-17.40083;14.66722;0;0;0;0;0;0;1;0;0;0;0;(vi);Cultural;C;Senegal;Sénégal;Africa;Afrique;sn;sen;0;14.66722,-17.40083
171;153;;"Niokolo-Koba National Park";"Parc national du Niokolo-Koba";"<p>Located in a well-watered area along the banks of the Gambia river, the gallery forests and savannahs of Niokolo-Koba National Park have a very rich fauna, among them Derby elands (largest of the antelopes), chimpanzees, lions, leopards and a large pop";"<p>Situ&eacute;es dans une zone bien irrigu&eacute;e, le long des rives de la Gambie, les for&ecirc;ts-galeries et les savanes du Niokolo-Koba abritent une faune d'une grande richesse : l'&eacute;lan de Derby (la plus grande des antilopes), des chimpanz&e";;;1981;;"Y 2007";-12.71667;13.06667;913000;0;0;0;0;0;0;0;0;0;1;(x);Natural;N;Senegal;Sénégal;Africa;Afrique;sn;sen;0;13.06667,-12.71667
1561;956;Bis;"Island of Saint-Louis";"Île de Saint-Louis";"<p>Founded as a French colonial settlement in the 17th century, Saint-Louis was urbanised in the mid-19th century. It was the capital of Senegal from 1872 to 1957 and played an important cultural and economic role in the whole of West Africa. The location";"<p>Fondée par les colons français au XVII<sup>e</sup> siècle, Saint-Louis s'urbanisa au milieu du XIX<sup>e</sup> siècle. Elle fut la capitale du Sénégal de 1872 à 1957 et joua un rôle culturel et économique prépondérant dans l'ensemble de l'Afrique occid";;;2000;;;-16.50444;16.02778;0;0;1;0;1;0;0;0;0;0;0;(ii)(iv);Cultural;C;Senegal;Sénégal;Africa;Afrique;sn;sen;0;16.02778,-16.50444
1754;1359;;"Saloum Delta";"Delta du Saloum";"<p>Fishing and shellfish gathering have sustained human life in the 5,000 km2 property, which is formed by the arms of three rivers. The site comprises brackish channels encompassing over 200 islands and islets, mangrove forest, an Atlantic marine environ";"<p>La p&ecirc;che et la cueillette ont fourni des ressources vitales aux communaut&eacute;s humaines sur ce bien de 5000 km&sup2;, form&eacute; par les bras de trois fleuves. Le site englobe des canaux d'eau saum&acirc;tre et pr&egrave;s de 200 &icirc;les";;;2011;;;-16.4986111111;13.8352777778;145811;0;0;1;1;1;0;0;0;0;0;(iii)(iv)(v);Cultural;C;Senegal;Sénégal;Africa;Afrique;sn;sen;0;13.8352777778,-16.4986111111
1832;1407;;"Bassari Country: Bassari, Fula and Bedik Cultural Landscapes";"Pays Bassari : paysages culturels Bassari, Peul et Bédik";"<p>The site, located in south-east Senegal, includes three geographical areas: the Bassari–Salémata area, the Bedik–Bandafassi area and the Fula–Dindéfello area, each with its specific morphological traits. The Bassari, Fula and Bedik peoples settled from";"<p>Situé dans le sud-est du Sénégal, le bien comprend trois régions géographiques différentes : celle des Bassari – zone de Salémata –, celle des Bédik – zone de Bandafassi – et celle des Peuls – zone de Dindéfello, présentant chacune des traits morpholog";;;2012;;;-12.8458333333;12.5933333333;50309;0;0;1;0;1;1;0;0;0;0;(iii)(v)(vi);Cultural;C;Senegal;Sénégal;Africa;Afrique;sn;sen;0;12.5933333333,-12.8458333333
