id;id_no;rev_bis;name_en;name_fr;short_description_en;short_description_fr;justification_en;justification_fr;date_inscribed;secondary_dates;danger_list;longitude;latitude;area_hectares;C1;C2;C3;C4;C5;C6;N7;N8;N9;N10;criteria_txt;category;category_short;states_name_en;states_name_fr;continent_name_en;continent_name_fr;iso_code;udnp_code;transboundary;coordonnees
1021;870;;"Historic Monuments of Ancient Nara";"Monuments historiques de l'ancienne Nara";"<p>Nara was the capital of Japan from 710 to 784. During this period the framework of national government was consolidated and Nara enjoyed great prosperity, emerging as the fountainhead of Japanese culture. The city's historic monuments &ndash; Buddhist ";"<p>Nara a &eacute;t&eacute; la capitale du Japon de 710 &agrave; 784. Durant cette p&eacute;riode, la structure du gouvernement national s'est consolid&eacute;e et la capitale, tr&egrave;s prosp&egrave;re, est devenue la source d'inspiration de la culture";"<p>Criterion (ii): The historic monuments of ancient Nara bear exceptional witness to the evolution of Japanese architecture and art as a result of cultural links with China and Korea which were to have a profound influence on future developments. Criteri";"<p>Crit&egrave;re (ii) : les monuments historiques de l&rsquo;ancienne Nara constituent des t&eacute;moins exceptionnels de l&rsquo;&eacute;volution de l&rsquo;architecture et de l&rsquo;art japonais, influenc&eacute;s par les liens culturels entretenus a";1998;;;135.8394444;34.67555556;617;0;1;1;1;0;1;0;0;0;0;(ii)(iii)(iv)(vi);Cultural;C;Japan;Japon;"Asia and the Pacific";"Asie et pacifique";jp;jpn;0;34.67555556,135.8394444
1066;913;;"Shrines and Temples of Nikko";"Sanctuaires et temples de Nikko";"<p>The shrines and temples of Nikko, together with their natural surroundings, have for centuries been a sacred site known for its architectural and decorative masterpieces. They are closely associated with the history of the Tokugawa Shoguns.</p>";"<p>Les sanctuaires et temples de Nikko, ainsi que le cadre naturel qui les entoure, constituent depuis des si&egrave;cles un lieu sacr&eacute; o&ugrave; se sont &eacute;lev&eacute;s des chefs-d'&oelig;uvre d'architecture et de d&eacute;coration artistique";"<p>Criterion (i): The Nikko shrines and temples are a reflection of architectural and artistic genius; this aspect is reinforced by the harmonious integration of the buildings in a forest and a natural site laid out by people.</p><p>Criterion (iv): Nikk";"<p>Crit&egrave;re i : les sanctuaires et temples de Nikko portent la marque du g&eacute;nie architectural et artistique ; ce caract&egrave;re est renforc&eacute; par la parfaite int&eacute;gration des &eacute;difices dans une for&ecirc;t et un site nature";1999;;;139.6105556;36.7475;50,8;1;0;0;1;0;1;0;0;0;0;(i)(iv)(vi);Cultural;C;Japan;Japon;"Asia and the Pacific";"Asie et pacifique";jp;jpn;0;36.7475,139.6105556
1136;972;;"Gusuku Sites and Related Properties of the Kingdom of Ryukyu";"Sites Gusuku et biens associés du royaume des Ryukyu";"<p>Five hundred years of Ryukyuan history (12th-17th century) are represented by this group of sites and monuments. The ruins of the castles, on imposing elevated sites, are evidence for the social structure over much of that period, while the sacred site";"<p>Ce groupe de sites et de monuments repr&eacute;sente cinq cents ans d'histoire des Ryukyu (XII<sup>e</sup> -XVII<sup>e</sup> si&egrave;cle). Les ch&acirc;teaux en ruine, qui se dressent sur d'imposantes hauteurs, illustrent la structure sociale d'une g";"<p><span class=""CmCaReT"" style=""display: none;"">?</span>Criterion ii For several centuries the Ryukyu islands served as a centre of economic and cultural interchange between south-east Asia, China, Korea, and Japan, and this is vividly demonstrated by the";"<p>Critère ii Pendant plusieurs siècles, les îles des Ryukyu ont servi de centre d’échanges économiques et culturels entre l’Asie du sud-est, la Chine, la Corée et le Japon, comme en témoignent avec force les monuments qui subsistent. Critère iii La cultu";2000;;;127.6827778;26.20861111;54,9;0;1;1;0;0;1;0;0;0;0;(ii)(iii)(vi);Cultural;C;Japan;Japon;"Asia and the Pacific";"Asie et pacifique";jp;jpn;0;26.20861111,127.6827778
2183;1142;;"Sacred Sites and Pilgrimage Routes in the Kii Mountain Range";"Sites sacrés et chemins de pèlerinage dans les monts Kii";"<p>Set in the dense forests of the Kii Mountains overlooking the Pacific Ocean, three sacred sites – Yoshino and Omine, Kumano Sanzan, Koyasan – linked by pilgrimage routes to the ancient capital cities of Nara and Kyoto, reflect the fusion of Shinto, roo";"<p>Nichés au cœur de forêts denses, dans les monts Kii qui surplombent l’océan Pacifique, trois sites sacrés, Yoshino et Omine, Kumano Sanzan et Koyasan, reliés par des chemins de pèlerinage aux anciennes capitales de Nara et Kyoto, reflètent la fusion en";"<p><em>Criterion (ii):</em> The monuments and sites that form the cultural landscape of the Kii Mountains are a unique fusion between Shintoism and Buddhism that illustrates the interchange and development of religious cultures in East Asia.</p><p><em>C";"<p><em>Critère (ii) :</em> Les monuments et les sites qui composent le paysage culturel des monts Kii forment une fusion unique entre le shintoïsme et le bouddhisme qui illustre l’échange et le développement des cultures religieuses en Asie orientale.</p>";2004;;;135.7763889;33.83694444;506,4;0;1;1;1;0;1;0;0;0;0;(ii)(iii)(iv)(vi);Cultural;C;Japan;Japon;"Asia and the Pacific";"Asie et pacifique";jp;jpn;0;33.83694444,135.7763889
1370;1193;;Shiretoko;Shiretoko;"<p>Shiretoko Peninsula is located in the north-east of Hokkaido, the northernmost island of Japan. The site includes the land from the central part of the peninsula to its tip (Shiretoko Cape) and the surrounding marine area. It provides an outstanding ex";"<p>La p&eacute;ninsule de Shiretoko est situ&eacute;e au nord-est de Hokkaido, l&rsquo;&icirc;le la plus au nord du Japon. Le site comporte une zone terrestre qui s&rsquo;&eacute;tend de la partie centrale de la p&eacute;ninsule jusqu&rsquo;&agrave; son e";"<p><em>Criterion (ix): </em>Shiretoko provides an outstanding example of the interaction of marine and terrestrial ecosystems as well as extraordinary ecosystem productivity, largely influenced by the formation of seasonal sea ice at the lowest latitude i";"<p><em>Crit&egrave;re (ix) : </em>Shiretoko est un exemple exceptionnel d&rsquo;interaction entre des &eacute;cosyst&egrave;mes terrestres et marins et illustre la productivit&eacute; extraordinaire des &eacute;cosyst&egrave;mes, largement influenc&eacute";2005;;;144.96583;43.94944;71100;0;0;0;0;0;0;0;0;1;1;(ix)(x);Natural;N;Japan;Japon;"Asia and the Pacific";"Asie et pacifique";jp;jpn;0;43.94944,144.96583
1737;1246;Bis;"Iwami Ginzan Silver Mine and its Cultural Landscape";"Mine d’argent d'Iwami Ginzan et son paysage culturel";"<p>The Iwami Ginzan Silver Mine in the south-west of Honshu Island is a cluster of mountains, rising to 600 m and interspersed by deep river valleys featuring the archaeological remains of large-scale mines, smelting and refining sites and mining settleme";"<p>Le site est un ensemble de montagnes riches en minerai d&rsquo;argent qui s&rsquo;&eacute;l&egrave;ve &agrave; 600 m d&rsquo;altitude dans le sud-ouest de l&rsquo;&icirc;le de Honshu et qui est entrecoup&eacute; de profondes vall&eacute;es fluviales. O";;;2007;;;132.435;35.1127777777;529,17;0;1;1;0;1;0;0;0;0;0;(ii)(iii)(v);Cultural;C;Japan;Japon;"Asia and the Pacific";"Asie et pacifique";jp;jpn;0;35.1127777777,132.435
1771;1277;rev;"Hiraizumi – Temples, Gardens and Archaeological Sites Representing the Buddhist Pure Land";"Hiraizumi – Temples, jardins et sites archéologiques représentant la Terre Pure bouddhiste";"<p>Hiraizumi - Temples, Gardens and Archaeological Sites Representing the Buddhist Pure Land&nbsp;comprises five sites, including the sacred Mount Kinkeisan. It features vestiges of government offices dating from the 11th and 12th centuries when Hiraizumi";"<p>Hiraizumi - Temples, jardins et sites arch&eacute;ologiques repr&eacute;sentant la Terre Pure bouddhiste&nbsp;regroupe six sites, dont la montagne sacr&eacute;e Kinkeisan. On y trouve des vestiges de b&acirc;timents gouvernementaux des XIe et XIIe si&e";;;2011;;;141.1077777778;39.0011111111;176,2;0;1;0;0;0;1;0;0;0;0;(ii)(vi);Cultural;C;Japan;Japon;"Asia and the Pacific";"Asie et pacifique";jp;jpn;0;39.0011111111,141.1077777778
1770;1362;;"Ogasawara Islands";"Îles d’Ogasawara";"<p>The property numbers more than 30 islands clustered in three groups and covers surface area of 7,939 hectares. The islands offer a variety of landscapes and are home to a wealth of fauna, including the Bonin Flying Fox, a critically endangered bat, and";"<p>Le bien compte plus de trente îles qui forment trois groupes et couvrent un total de 7 939 hectares. Elles offrent une grande variété de paysages et hébergent une faune riche, dont la roussette des Bonins qui est en danger critique d'extinction et 195 ";;;2011;;;142.0997222222;27.7183333333;7939;0;0;0;0;0;0;0;0;1;0;(ix);Natural;N;Japan;Japon;"Asia and the Pacific";"Asie et pacifique";jp;jpn;0;27.7183333333,142.0997222222
1883;1418;;"Fujisan, sacred place and source of artistic inspiration";"Fujisan, lieu sacré et source d'inspiration artistique";"<p>The beauty of the solitary, often snow-capped, stratovolcano, known around the world as Mount Fuji, rising above villages and tree-fringed sea and lakes has long been the object of pilgrimages and inspired artists and poets. The inscribed property cons";"<p>La beaut&eacute; de ce volcan solitaire, souvent couronn&eacute; de neige, s&rsquo;&eacute;levant au-dessus de villages, de la mer et de lacs bord&eacute;s d&rsquo;arbres, a inspir&eacute; artistes et po&egrave;tes. Il s&rsquo;agit d&rsquo;un lieu de p";;;2013;;;138.7275;35.3608333333;20702,1;0;0;1;0;0;1;0;0;0;0;(iii)(vi);Cultural;C;Japan;Japon;"Asia and the Pacific";"Asie et pacifique";jp;jpn;0;35.3608333333,138.7275
1992;1449;;"Tomioka Silk Mill and Related Sites";"Filature de soie de Tomioka et sites associés";"<p>This property is a historic sericulture and silk mill complex established in the late 19th and early 20th century in the Gunma prefecture, north-west of Tokyo. It consists of four sites that correspond to the different stages in the production of raw s";"<p>Créé en 1872, ce complexe historique séricicole et de filature de la soie se situe dans la préfecture de Gunma, au nord-ouest de Tokyo. Construit par le gouvernement, avec des machines importées de France, il se compose de quatre sites qui corresponden";;;2014;;;138.8877777778;36.2552777778;7,2;0;1;0;1;0;0;0;0;0;0;(ii)(iv);Cultural;C;Japan;Japon;"Asia and the Pacific";"Asie et pacifique";jp;jpn;0;36.2552777778,138.8877777778
2045;1484;;"Sites of Japan’s Meiji Industrial Revolution: Iron and Steel, Shipbuilding and Coal Mining";"Sites de la révolution industrielle Meiji au Japon : sidérurgie, construction navale et extraction houillère";"<p><span>The site encompasses a series of twenty three component parts, mainly located in the southwest of Japan. It bears testimony to the rapid industrialization of the country from the middle of the 19</span><sup>th</sup><span> century to the early 20<";"<p><span>Le bien est composé d’une série de vingt-trois composantes se trouvant essentiellement dans le sud-ouest du Japon. Cet ensemble témoigne du développement industriel rapide qu’a connu le pays entre le milieu du XIXe et le début du XXe siècle, fond";;;2015;;;131.4122222222;34.4305555556;306,66;0;1;0;1;0;0;0;0;0;0;(ii)(iv);Cultural;C;Japan;Japon;"Asia and the Pacific";"Asie et pacifique";jp;jpn;0;34.4305555556,131.4122222222
165;148;Rev;"Old City of Jerusalem and its Walls";"Vieille ville de Jérusalem et ses remparts";"<p>As a holy city for Judaism, Christianity and Islam, Jerusalem has always been of great symbolic importance. Among its 220 historic monuments, the Dome of the Rock stands out: built in the 7th century, it is decorated with beautiful geometric and floral";"<p>Ville sainte du juda&iuml;sme, du christianisme et de l'islam, J&eacute;rusalem a toujours eu une valeur symbolique. Parmi ses 220 monuments historiques, se d&eacute;tache le formidable D&ocirc;me du Rocher, construit au VII<sup>e</sup> si&egrave;cle e";;;1981;;"Y 1982";35.21666667;31.78333333;0;0;1;1;0;0;1;0;0;0;0;(ii)(iii)(vi);Cultural;C;"Jerusalem (Site proposed by Jordan)";"Jérusalem (site proposé par la Jordanie)";"Arab States";"États arabes";;;0;31.78333333,35.21666667
370;326;;Petra;Petra;"<p>Inhabited since prehistoric times, this Nabataean caravan-city, situated between the Red Sea and the Dead Sea, was an important crossroads between Arabia, Egypt and Syria-Phoenicia. Petra is half-built, half-carved into the rock, and is surrounded by m";"<p>Habit&eacute;e depuis la pr&eacute;histoire, cette cit&eacute; caravani&egrave;re nabat&eacute;enne situ&eacute;e entre la mer Rouge et la mer Morte fut dans l'Antiquit&eacute; un carrefour important entre l'Arabie, l'&Eacute;gypte et la Syrie-Ph&eacut";;;1985;;;35.44333;30.33056;26171;1;0;1;1;0;0;0;0;0;0;(i)(iii)(iv);Cultural;C;Jordan;Jordanie;"Arab States";"États arabes";jo;jor;0;30.33056,35.44333
372;327;;"Quseir Amra";"Qusair Amra";"<p>Built in the early 8th century, this exceptionally well-preserved desert castle was both a fortress with a garrison and a residence of the Umayyad caliphs. The most outstanding features of this small pleasure palace are the reception hall and the <em>h";"<p>Construit au d&eacute;but du VIII<sup>e</sup> si&egrave;cle, ce ch&acirc;teau du d&eacute;sert, particuli&egrave;rement bien conserv&eacute;, &eacute;tait &agrave; la fois une forteresse abritant une garnison et une r&eacute;sidence des califes omeyyad";;;1985;;;36.58583;31.80194;0;1;0;1;1;0;0;0;0;0;0;(i)(iii)(iv);Cultural;C;Jordan;Jordanie;"Arab States";"États arabes";jo;jor;0;31.80194,36.58583
1271;1093;;"Um er-Rasas (Kastrom Mefa'a)";"Um er-Rasas (Kastrom Mefa’a)";"<p>Most of this archaeological site, which started as a Roman military camp and grew to become a town from the 5th century, has not been excavated. It contains remains from the Roman, Byzantine and Early Muslim periods (end of 3rd to 9th centuries AD) and";"<p>L&rsquo;essentiel du site arch&eacute;ologique d&rsquo;Um er-Rasas n&rsquo;a pas encore &eacute;t&eacute; fouill&eacute;. Le site, qui comprend des vestiges des p&eacute;riodes romaine, byzantine et du d&eacute;but de l&rsquo;islam (de la fin du IIIe a";"<p><em>Criterion (i):</em> Um er-Rasas is a masterpiece of human creative genius given the artistic and technical qualities of the mosaic floor of St Stephen's church.</p><p><em>Criterion (iv):</em> Um er-Rasas presents a unique and complete (therefore ";"<p><em>Crit&egrave;re (i)&nbsp;:</em> Um er-Rasas est un chef d'oeuvre du g&eacute;nie cr&eacute;ateur humain en raison des qualit&eacute;s artistiques et techniques du sol en mosa&iuml;que de l'Eglise Saint-Etienne.</p><p><em>Crit&egrave;re (iv)&nbsp;:";2004;;;35.92056;31.50167;23,928;1;0;0;1;0;1;0;0;0;0;(i)(iv)(vi);Cultural;C;Jordan;Jordanie;"Arab States";"États arabes";jo;jor;0;31.50167,35.92056
1758;1377;;"Wadi Rum Protected Area";"Zone protégée du Wadi Rum";"<p>The 74,000-hectare property, inscribed as a mixed natural and cultural site, is situated in southern Jordan, near the border with Saudi Arabia. It features a varied desert landscape consisting of a range of narrow gorges, natural arches, towering cliff";"<p>Ce bien couvrant 74 000 hectares, inscrit comme site mixte naturel et culturel, se trouve au sud de la Jordanie, pr&egrave;s de la fronti&egrave;re avec l'Arabie saoudite. Il s'agit d'un paysage d&eacute;sertique tr&egrave;s spectaculaire, avec des can";;;2011;;;35.4338888889;29.6397222222;74179,7;0;0;1;0;1;0;1;0;0;0;(iii)(v)(vii);Mixed;C/N;Jordan;Jordanie;"Arab States";"États arabes";jo;jor;0;29.6397222222,35.4338888889
2019;1446;;"Baptism Site “Bethany Beyond the Jordan” (Al-Maghtas)";"Site du baptême « Béthanie au-delà du Jourdain » (Al-Maghtas)";"<p><span>Situated on the eastern bank of the River Jordan, nine kilometres north of the Dead Sea, the archaeological site consists of two distinct areas: Tell Al-Kharrar, also known as Jabal Mar-Elias (Elijah’s Hill) and the area of the churches of Saint ";"<p><span>Situé sur les rives orientales du Jourdain, à neuf kilomètres au nord de la Mer morte, le site archéologique inclut deux zones archéologiques principales, Tell Al-Kharrar, également connue sous le nom de Jabal Mar Elias (la colline d’Élie), et la";;;2015;;;35.5527777778;31.8372222222;294,155;0;0;1;0;0;1;0;0;0;0;(iii)(vi);Cultural;C;Jordan;Jordanie;"Arab States";"États arabes";jo;jor;0;31.8372222222,35.5527777778
1543;1102;Rev;"Saryarka – Steppe and Lakes of Northern Kazakhstan";"Saryarka - Steppe et lacs du Kazakhstan septentrional";"<p>Saryarka - Steppe and Lakes of Northern Kazakhstan comprises two protected areas: Naurzum State Nature Reserve and Korgalzhyn State Nature Reserve totalling 450,344 ha. It features wetlands of outstanding importance for migratory water birds, including";"<p>Saryarka &ndash; Steppe et lacs du Kazakhstan septentrional, comprend deux zones prot&eacute;g&eacute;es : la R&eacute;serve naturelle d&rsquo;Etat de Naurzum et la R&eacute;serve naturelle d&rsquo;Etat de Korgalzhyn totalisant une surface de 450 344 h";;;2008;;;69.1888888889;50.4333333333;450344;0;0;0;0;0;0;0;0;1;1;(ix)(x);Natural;N;Kazakhstan;Kazakhstan;"Asia and the Pacific";"Asie et pacifique";kz;kaz;0;50.4333333333,69.1888888889
1281;1103;;"Mausoleum of Khoja Ahmed Yasawi";"Mausolée de Khoja Ahmad Yasawi";"<p>The Mausoleum of Khoja Ahmed Yasawi, in the town of Yasi, now Turkestan, was built at the time of Timur (Tamerlane), from 1389 to 1405. In this partly unfinished building, Persian master builders experimented with architectural and structural solutions";"<p>Le mausol&eacute;e de Khoja Ahmad Yasawi, dans la ville de Yasi, aujourd&rsquo;hui appel&eacute;e Turkestan, fut construit &agrave; l&rsquo;&eacute;poque de Tamerlan, de&nbsp;1389 &agrave;&nbsp;1405. Dans ce b&acirc;timent, dont certaines parties demeu";"<p>Criterion i: The Mausoleum of Khoja Ahmed Yasawi is an outstanding achievement in the Timurid architecture, and it has significantly contributed to the development of Islamic religious architecture. Criterion iii: The mausoleum and its site represent a";"<p>Crit&egrave;re i Le mausol&eacute;e de Khoja Ahmad Yasawi est une r&eacute;alisation exceptionnelle de l&rsquo;architecture timuride ; il a contribu&eacute; de mani&egrave;re importante au d&eacute;veloppement de l&rsquo;architecture religieuse islamiq";2003;;;68.27444444;43.29305556;0,55;1;0;1;1;0;0;0;0;0;0;(i)(iii)(iv);Cultural;C;Kazakhstan;Kazakhstan;"Asia and the Pacific";"Asie et pacifique";kz;kaz;0;43.29305556,68.27444444
1326;1145;;"Petroglyphs within the Archaeological Landscape of Tamgaly";"Pétroglyphes du paysage archéologique de Tamgaly";"<p>Set around the lush Tamgaly Gorge, amidst the vast, arid Chu-Ili mountains, is a remarkable concentration of some 5,000 petroglyphs (rock carvings) dating from the second half of the second millennium BC to the beginning of the 20th century. Distribute";"<p>Les environs de la gorge de Tamgaly, relativement luxuriante par rapport aux vastes et arides monts Chu-Ili, rec&egrave;lent une remarquable concentration de quelque 5 000 p&eacute;troglyphes (gravures sur pierre) ; leur datation va de la seconde moiti";"<p><em>Criterion (iii):</em> The dense and coherent group of petroglyphs, with sacred images, altars and cult areas, together with their associated settlements and burial sites, provide a substantial testimony to the lives and beliefs of pastoral peoples ";"<p><em>Crit&egrave;re (iii)&nbsp;:</em> L&rsquo;ensemble dense et coh&eacute;rent de p&eacute;troglyphes, avec les images sacr&eacute;es, les autels et les lieux de culte, ainsi que les &eacute;tablissements et sites associ&eacute;s, constituent un t&eacu";2004;;;75.535;43.80333333;900;0;0;1;0;0;0;0;0;0;0;(iii);Cultural;C;Kazakhstan;Kazakhstan;"Asia and the Pacific";"Asie et pacifique";kz;kaz;0;43.80333333,75.535
1902;800;Bis;"Mount Kenya National Park/Natural Forest";"Parc national/Forêt naturelle du mont Kenya";"<p>At 5,199 m, Mount Kenya is the second highest peak in Africa. It is an ancient extinct volcano, which during its period of activity (3.1-2.6 million years ago) is thought to have risen to 6,500 m. There are 12 remnant glaciers on the mountain, all rece";"<p>Culminant à 5.199 m, le mont Kenya est le deuxième plus haut sommet d’Afrique. C’est un ancien volcan éteint qui, durant sa période d’activité (il y a 3,1-2,6 millions d’années), aurait atteint 6.500 m. Il reste une douzaine de glaciers sur la montagne";;;1997;2013;;37.3155555556;-0.155;202334;0;0;0;0;0;0;1;0;1;0;(vii)(ix);Natural;N;Kenya;Kenya;Africa;Afrique;ke;ken;0;-0.155,37.3155555556
947;801;Bis;"Lake Turkana National Parks";"Parcs nationaux du Lac Turkana";"<p>The most saline of Africa's large lakes, Turkana is an outstanding laboratory for the study of plant and animal communities. The three National Parks serve as a stopover for migrant waterfowl and are major breeding grounds for the Nile crocodile, hippo";"<p>Le plus salé des grands lacs d'Afrique, le Turkana, est un laboratoire exceptionnel pour l'étude des communautés végétales et animales. Les trois parcs nationaux servent d'étapes aux oiseaux d'eau migrateurs et constituent d'importantes zones de reprod";"<p>The Committee inscribed this property on the basis of natural <em>criteria (viii)</em> and <em>(x)</em> for the discoveries of mammal fossil remains in the site which led to the scientific reconstruction of the palaeo-environment of the entire Turkana ";"<p>Le Comité a inscrit ce bien au titre des <em>critères naturels (viii)</em> et <em>(x)</em> en raison de la découverte de vestiges fossiles de mammifères sur le site qui ont permis la reconstitution scientifique de l'environnement paléologique de tout l";1997;2001;;36.50366667;3.051305556;161485;0;0;0;0;0;0;0;1;0;1;(viii)(x);Natural;N;Kenya;Kenya;Africa;Afrique;ke;ken;0;3.051305556,36.50366667
1229;1055;;"Lamu Old Town";"Vieille ville de Lamu";"<p>Lamu Old Town is the oldest and best-preserved Swahili settlement in East Africa, retaining its traditional functions. Built in coral stone and mangrove timber, the town is characterized by the simplicity of structural forms enriched by such features a";"<p>La vieille ville de Lamu, qui est le plus ancien et le mieux pr&eacute;serv&eacute; des lieux de peuplement swahilis en Afrique de l'Est, conserve ses fonctions traditionnelles. Construite en roches coralliennes et de bois de pal&eacute;tuvier, la vill";"<p>Criterion ii The architecture and urban structure Lamu graphically demonstrate the cultural influences that have come together there over several hundred years from Europe, Arabia, and India, utilizing traditional Swahili techniques to produce a distin";"<p>Crit&egrave;re ii L&rsquo;architecture et la structure urbaine de Lamu d&eacute;montrent de mani&egrave;re vivante les influences culturelles venues d&rsquo;Europe, d&rsquo;Arabie et d&rsquo;Inde qui s&rsquo;y sont m&ecirc;l&eacute;es pendant plusieurs";2001;;;40.8525;-2.284444444;15,6;0;1;0;1;0;1;0;0;0;0;(ii)(iv)(vi);Cultural;C;Kenya;Kenya;Africa;Afrique;ke;ken;0;-2.284444444,40.8525
1749;1060;rev;"Kenya Lake System in the Great Rift Valley";"Réseau des lacs du Kenya dans la vallée du Grand Rift";"<p>The Kenya Lake System in the Great Rift Valley , a natural property of outstanding beauty, comprises three inter-linked relatively shallow lakes (Lake Bogoria, Lake Nakuru and Lake Elementaita) in the Rift Valley Province of Kenya and covers a total ar";"<p>Le R&eacute;seau des lacs du Kenya dans la vall&eacute;e du Grand Rift comprend trois lacs interconnect&eacute;s et peu profonds (Lac Bogoria, lac Nakuru et Lac Elementaita) qui se trouvent dans la province de la Rift Valley au Kenya. Sa superficie est";;;2011;;;36.24;-0.4425;32034;0;0;0;0;0;0;1;0;1;1;(vii)(ix)(x);Natural;N;Kenya;Kenya;Africa;Afrique;ke;ken;0;-0.4425,36.24
1589;1231;Rev;"Sacred Mijikenda Kaya Forests";"Forêts sacrées de kayas des Mijikenda";"<p>The Mijikenda Kaya Forests consist of 11 separate forest sites spread over some 200 km along the coast containing the remains of numerous fortified villages, known as kayas, of the Mijikenda people. The kayas, created as of the 16th century but abandon";"<p>Les for&ecirc;ts sacr&eacute;es de kaya des Mijikenda consistent en 11 sites forestiers distincts qui s''&eacute;tendent sur pr&egrave;s de 200 km le long de la c&ocirc;te. Ils rec&egrave;lent les vestiges de nombreux villages fortifi&eacute;s, les kay";;;2008;;;39.5961111111;-3.9319444444;1538;0;0;1;0;1;1;0;0;0;0;(iii)(v)(vi);Cultural;C;Kenya;Kenya;Africa;Afrique;ke;ken;0;-3.9319444444,39.5961111111
1847;1295;rev;"Fort Jesus, Mombasa";"Fort Jésus, Mombasa";"<p>The Fort, built by the Portuguese in 1593-1596 to the designs of Giovanni Battista Cairati to protect the port of Mombasa, is one of the most outstanding and well preserved examples of 16th Portuguese military fortification and a landmark in the histor";"<p>Le Fort, &eacute;difi&eacute; par les Portugais en 1593-1596 selon les plans de Giovanni Battista Cairati pour prot&eacute;ger le port de Mombasa, est l'un des exemples les plus remarquables et les mieux pr&eacute;serv&eacute;s de fortification militai";;;2011;;;39.6794444444;-4.0627777778;2,36;0;1;0;0;1;0;0;0;0;0;(ii)(v);Cultural;C;Kenya;Kenya;Africa;Afrique;ke;ken;0;-4.0627777778,39.6794444444
